recid	issueID	user	createtime	updatetime	text	identifier
137	65	user3	1488657513	1488657513	I'll get started on travis CI by tonight ?? 	284176800
131	65	user2	1488657106	1488657106	"@DevArenaCN I require admin rights for the organization or this repo, to enable the integration. Can you grant me that"	284176389
138	65	user1	1488677166	1488677166	Done. Sorry about the delay	284197831
130	65	user1	1488656769	1488656769	I have authorized it a few mins ago. I'm gonna try to do that for the server side as well. 	284176054
129	65	user2	1488656685	1488656685	@DevArenaCN @KaustubhG You would have received a mail to grant authorization to travisCI for the organization repo. That's needed to integrate with travis. 	284175987
135	65	user2	1488657385	1488657385	@KaustubhG Hmm maybe only the person with admin rights to the org repo gets it.	284176681
133	65	user3	1488657287	1488657287	@thegreyd  I didn't receive a mail for granting authorization to travis CI...  	284176569
132	65	user1	1488657157	1488657157	I thought I already did. I'll double check in a few mins. 	284176445
140	69	user2	1488745114	1488745114	Donezo	284259094
147	71	user2	1488940662	1488940662	Automatic release deployment is tested and working. The process of release-> tag commit in local branch. pull request to master. travis detects tag and deploys from master branch.	284928750
169	79	user2	1492114490	1492114490	Future improvement 	294009913
157	79	user1	1489427036	1489427036	"I'm going to get the icon and logo ready before Thursday, after the midterm"	286186178
152	82	user2	1489029573	1489029610	"At login screen button disabling is a bad idea. Other places buttons removed, merged into one."	285243198
158	84	user1	1489427053	1489427053	"I believe this one is done, right?"	286186283
159	84	user2	1489600023	1489600023	"The structure is there, but Not fully implemented."	286823928
168	84	user2	1492114472	1492114472	Future improvement	294009850
160	85	user2	1489600091	1489600091	Not done. Looking into it. 	286824346
156	85	user1	1489426977	1489426977	Any updates?	286185857
166	85	user2	1492114420	1492114420	Future improvement	294009649
154	86	user2	1489381063	1489381063	Looks good	286015653
165	87	user3	1490132003	1490132003	"Sure, w'll work on that"	288225941
164	87	user1	1490131190	1490131190	"@thegreyd I'll add the Microsoft cognitiveId in the registration form and I'll write another API for getting that info, that will be done before Thursday. In the meantime, if @thegreyd and @KaustubhG could look into implementing some timing module inside "	288222340
167	87	user2	1492114453	1492114453	Done	294009784
162	87	user2	1490123856	1490123883	"Yes, Let's put a signup sheet for that. When are you guys free next week. We should discuss the work needed for user eval, server and app.     For the app i think, we need to prepare instructions to tell the user what to do. App icon and logo would be good.    For the server side, integrating microsoft api call for profile creation at account creation. This will make the voice login process very convenient for the end user.     Apart from these I don't think we need more. We could implement timing in the app, that would depend on how easy it is, and what kind of statistics we record."	288189066
163	87	user3	1490127370	1490127370	We can start discussing over the weekend via comments and meetup next week maybe Tuesday.  How about that?	288204584
